{
  "schema_version": 1,
  "candidate_id": "doctrine.stripe-stripe-checkout-must-use-official-stripe-docs-before-scri.20260501153150",
  "created_at": "2026-05-01T15:31:50.857Z",
  "source": {
    "kind": "prompt",
    "path": null,
    "excerpt": "Stripe checkout must use official Stripe docs before script generation."
  },
  "natural_rule_intake": {
    "received_as": "prompt_rule",
    "user_label_required": false
  },
  "classification": "domain_rule",
  "domain": "stripe",
  "activation_trigger": "stripe stripe checkout must use official stripe docs before script gene",
  "invariant": "Stripe checkout must use official Stripe docs before script generation.",
  "authority_packet": {
    "schema_version": 1,
    "authority_packet_id": "authority.stripe.20260501153150",
    "created_at": "2026-05-01T15:31:50.856Z",
    "intent": "Stripe checkout must use official Stripe docs before script generation. Stripe checkout must use official Stripe docs before script generation.",
    "domain": "stripe",
    "authority_state": "official",
    "references": [
      {
        "id": "stripe.docs",
        "label": "Stripe Documentation",
        "authority_class": "external",
        "url": "https://docs.stripe.com/",
        "source_path": null,
        "scope": "Stripe API, Checkout, Billing, payments, and integration patterns."
      },
      {
        "id": "stripe.api",
        "label": "Stripe API Reference",
        "authority_class": "external",
        "url": "https://docs.stripe.com/api",
        "source_path": null,
        "scope": "Stripe API object and endpoint reference."
      }
    ],
    "created_authority": {
      "required": false,
      "reason": "",
      "experiment_path": null
    },
    "lineage": {
      "sequence_rank": "SEQ-D",
      "script_id": "refer.authority.resolve",
      "evidence": [
        "stripe.docs",
        "stripe.api"
      ]
    }
  },
  "script_blueprint": {
    "script_id": "candidate.stripe-stripe-checkout-must-use-official-stripe-docs-before-scri",
    "script_class": "Domain Script",
    "intended_effect": "Enforce or apply rule: Stripe checkout must use official Stripe docs before script generation.",
    "allowed_boundary": "Candidate only. No active governance until fixtures pass and registry promotion occurs.",
    "reads": [
      "natural-rule-intake",
      ".refer-factory/authority/latest.json"
    ],
    "writes": [
      ".refer-factory/doctrine-candidates/**"
    ],
    "locks": [
      ".refer-factory/doctrine-candidates/stripe-stripe-checkout-must-use-official-stripe-docs-before-scri"
    ]
  },
  "fixtures": [
    {
      "id": "stripe-stripe-checkout-must-use-official-stripe-docs-before-scri.positive",
      "given": "A request matching trigger: stripe stripe checkout must use official stripe docs before script gene",
      "expect": "Candidate rule applies: Stripe checkout must use official Stripe docs before script generation."
    },
    {
      "id": "stripe-stripe-checkout-must-use-official-stripe-docs-before-scri.inactive-until-promoted",
      "given": "Candidate has not been promoted.",
      "expect": "Rule remains inactive and does not control builds."
    }
  ],
  "sequence": {
    "rank": "SEQ-F",
    "sub_sequence": [
      "SEQ-F"
    ],
    "conditional_action": "continue"
  },
  "status": "candidate"
}
